{
  "caseId": "24ce9c6a-a4f9-42bf-a7c3-237f3beca38e",
  "voiceSessionId": "4886d15d-0cf6-4543-b30a-f203cf263d90",
  "caseRevision": 4,
  "contextRevision": 7,
  "mappingVersion": "voice-portfolio-v1",
  "proposalBatch": {
    "id": "8add1dec-2ab6-4008-b156-f50ef862f4ff",
    "messageId": "income_extraction",
    "source": {
      "messageId": "income_extraction",
      "turnId": "turn_2",
      "sourceRef": "voice:4886d15d-0cf6-4543-b30a-f203cf263d90:income_extraction"
    },
    "createdAt": "2026-10-31T13:49:48.972Z",
    "requestHash": "9a54aabb04554383f5c8679cb07c156d2f1f7cf183f6f9f81c1d5377eeef8e60",
    "expectedProfileVersion": 1,
    "basisDraftHash": "d50aa8e4ce0a4a17d13a2a62bddc9bef71d27519eab85ba10070c7bb0a4f4b1f",
    "changes": [
      {
        "path": "insurance.persons.0.grossAnnualIncomeCents",
        "value": 11900000,
        "personId": "person_demo_1"
      }
    ],
    "status": "proposed",
    "supersedesBatchIds": [],
    "supersedesProposalIds": [],
    "replacedByBatchId": null,
    "ambiguityIds": [],
    "resolvesAmbiguityIds": [],
    "acceptedAt": null
  },
  "issues": [],
  "confirmationStillRequired": true,
  "replayed": false
}
